{
  "schema_version": "1.0.0",
  "event_id": "50000000-0000-4000-8000-000000000001",
  "run_id": "ocr-replay-001",
  "sensor": {
    "id": "ocr.number",
    "instance_id": "number-ocr-01",
    "version": "0.2.0",
    "category": "processor"
  },
  "sequence": 0,
  "time": {
    "observed_at": "2026-08-16T08:00:00.000Z",
    "emitted_at": "2026-08-16T08:00:00.042Z",
    "source_timestamp": 1,
    "monotonic_ns": 1000000,
    "clock": {
      "domain": "recorded-frame",
      "sync_status": "unknown",
      "uncertainty_ms": null
    }
  },
  "status": "ok",
  "quality": {
    "confidence": 0.94,
    "latency_ms": 42,
    "flags": ["recorded-replay"],
    "dropped_since_last": 0
  },
  "measurements": [
    {"name": "recognized_value", "value": -2.33, "value_type": "number", "unit": "N", "role": "derived", "uncertainty": null}
  ],
  "parent_event_ids": ["10000000-0000-4000-8000-000000000001"],
  "payload": {
    "roi_id": "force-y",
    "roi": {"x": 0.36, "y": 0.535, "width": 0.28, "height": 0.05},
    "name": "Fy",
    "symbol": "Fy",
    "raw_text": "-2.33",
    "normalized_text": "-2.33",
    "confidence": 0.94,
    "duration_ms": 42,
    "warning": null,
    "recognition_error": null,
    "recognizer": "tesseract"
  }
}
